Week,Day,Owner,Theme,Post_Content,Visual_Asset,Status,,Date,Source_Post,Contact_Name,Company,Interaction_Type,Action_Required,Owner
Week 3,Tue,Anuj,The 4 Dimensions,We need a compass for AI readiness. North: Statistical Health. East: Semantic Clarity. South: Contextual Validity. West: Governance & Safety. Which direction is your organization ignoring? #AIReadiness,Slide: 4 Dimensions Compass (Page 3),Draft,,,,,,,,
Week 3,Wed,Nina,Semantic Clarity,Looking forward to Julia Fox's (Takeda) talk on Semantic Tools. We can't have AI 'reason' if data lacks definitions. This is East on the Compass. Level 1 is a match. Level 3 is inference. Where is your lab?,Slide: ML-Hybrid Ontology (Page 13),Draft,,,,,,,,
Week 3,Thu,Ben,Execution Risk,"70% of data initiatives fail. It's usually people, not tech. I'm heading to Boston to talk about the 'Execution' side of the equation. DM me if you want to see our readiness scorecard.",Slide: 70% Failure Stat (Page 21),Draft,,,,,,,,
Week 4,Tue,Anuj,Soft Launch,We've been working on something that automates the 'Ready' assessment across all 4 dimensions. It's called Data Compass. We'll be demoing how it solves the Proxy Problem live in Boston. #DataCompass #Launch,Image: Product Logo/Teaser,Draft,,,,,,,,
Week 4,Wed,Nina,Automating Fairness,"Humans can't check millions of rows for bias. Algorithms can. I'll be showing how we calculate Shannon entropy for demographic representation (that's North (Statistical Health) on the Data Compass, specifically the Bias Risk component of ML Readiness) on the fly. Catch me after Yves Fomekong Nanfack's session.",Slide: Bias Assessment Dashboard (Page 6),Draft,,,,,,,,
Week 4,Thu,Ben,Calendar Drop,"My calendar for Boston is filling up. I have 4 slots left for anyone who wants a 15-minute 'Readiness Audit' of their current strategy. First come, first served.",Do we have a mechanism to automatically book appointments like calendly?,Draft,,,,,,,,
